_id,kind,source,title,authority,state,amount,deadline,eligibility[0],eligibility[1],desc,link,tags[0],tags[1],tags[2],tags[3],thumbnail,previewUrl,downloadUrl
69117192679cf15c0733a518,Scholarship,Government,National Merit Scholarship,Ministry of Education,Karnataka,"₹50,000 per year",2025-12-31T00:00:00.000Z,10+2 Students,Above 85% Marks,A scholarship for meritorious students pursuing higher education.,https://www.youthforseva.org/NMMS?https://youthforseva.org/nmms&gad_source=1&gad_campaignid=18320487014&gbraid=0AAAAADKmqtz4UC5t21JXs3l5bs0lrtg3V&gclid=CjwKCAiAlMHIBhAcEiwAZhZBUo5UyczFc4tkQupIxs2AU3jvDU0I-WZJvFgOP1irAkp_5zBbJvpJbhoCKxwQAvD_BwE,Merit,Undergraduate,National,,https://example.com/images/merit-thumb.jpg,https://example.com/docs/merit-preview.pdf,https://example.com/docs/merit-brochure.pdf
691171b3679cf15c0733a519,Loan,NGO,Skill Development Student Loan,EduGrow Foundation,Maharashtra,"Up to ₹2,00,000",2025-08-15T00:00:00.000Z,Indian citizens aged 18–30,Enrolled in certified skill training programs,A low-interest loan designed to support youth in completing technical and vocational training programs.,https://www.myscheme.gov.in/schemes/sl,Skill,Loan,Vocational,Youth,https://example.com/images/loan-thumb.jpg,https://example.com/docs/loan-preview.pdf,https://example.com/docs/loan-application.pdf
691171cc679cf15c0733a51a,Incentive,Government,Startup Innovation Grant,Department of Science and Technology,Telangana,"Up to ₹10,00,000",2025-09-30T00:00:00.000Z,Early-stage startups registered in India,"Focus on science, technology, or innovation",A government incentive program supporting startups with seed funding and mentorship for innovative projects.,https://seedfund.startupindia.gov.in/,Startup,Innovation,Technology,Seed Funding,https://example.com/images/startup-thumb.jpg,https://example.com/docs/startup-preview.pdf,https://example.com/docs/startup-guidelines.pdf
691171e6679cf15c0733a51b,Scholarship,NGO,Bright Future Scholarship Program,BrightFuture Trust,Tamil Nadu,"₹75,000 per academic year",2025-07-10T00:00:00.000Z,Students from low-income families,Enrolled in undergraduate degree courses,A need-based scholarship that supports talented students from economically weaker backgrounds to pursue higher education.,https://bigfuture.collegeboard.org/scholarships/the-bright-futures-scholarship,Education,Undergraduate,Financial Aid,Merit,https://example.com/images/brightfuture-thumb.jpg,https://example.com/docs/brightfuture-preview.pdf,https://example.com/docs/brightfuture-form.pdf
69117203679cf15c0733a51c,Loan,Government,Prime Startup Loan Scheme,"Ministry of Micro, Small & Medium Enterprises",Gujarat,"Up to ₹25,00,000",2025-10-20T00:00:00.000Z,Entrepreneurs aged 21–45,Registered MSMEs with valid business plans,A government-backed loan program that provides financial support to small business owners and entrepreneurs to promote self-employment and innovation.,https://www.myscheme.gov.in/schemes/pmmy,Entrepreneurship,MSME,Business,Loan,https://example.com/images/prime-loan-thumb.jpg,https://example.com/docs/prime-loan-preview.pdf,https://example.com/docs/prime-loan-application.pdf
69117215679cf15c0733a51d,Incentive,NGO,Inspire Teaching Excellence Award,EduCare Foundation,Kerala,"₹1,00,000 + Recognition Certificate",2025-06-30T00:00:00.000Z,School teachers with 5+ years of experience,Proven record of innovation in classroom teaching,An annual incentive recognizing teachers who demonstrate outstanding dedication and creativity in improving the quality of education.,https://nationalawardstoteachers.education.gov.in ,Teacher,Education,Incentive,Recognition,https://example.com/images/inspire-award-thumb.jpg,https://example.com/docs/inspire-award-preview.pdf,https://example.com/docs/inspire-award-guidelines.pdf
